{"config_sha256":"233e5d301a8e3b9087065474e386a6db213ff7ec2e2b20bf3d5d54cb69110cb6","entities":[{"aliases":[],"canonical_name":"Aylin Demo","entity_id":"person:aylin_demo","kind":"person","registry_version":"demo-v1"},{"aliases":[],"canonical_name":"Bora Example","entity_id":"person:bora_example","kind":"person","registry_version":"demo-v1"},{"aliases":[],"canonical_name":"Cem Sample","entity_id":"person:cem_sample","kind":"person","registry_version":"demo-v1"},{"aliases":[],"canonical_name":"Solstice Mathematics Workshop","entity_id":"event:solstice_workshop","kind":"event","registry_version":"demo-v1"}],"error":null,"evidence":[{"evidence_id":"evidence:synthetic_meridian_note:1","note":"Synthetic demonstration evidence; not a historical claim.","page_end":null,"page_start":null,"page_status":"not_paginated","quote":"Professor Bora Example supervised Aylin Demo's doctoral work.","quote_sha256":"fef6d974537c1da03e524f1a8ef79a4d325c2f74e310dd8f8d3c0d40753b057c","source_id":"source:synthetic_meridian_note","source_sha256":"87abdce55610c805edcbb0f169c54de090c66ac7690652163b221d013a88eadd","text_artifact_sha256":"c2384202e233a9dcb311ddd4ea7650a358d7bc444965f04b32e1517c4fd0f0d6","verification":{"char_end":98,"char_start":37,"match_count":1,"matched_text_sha256":"fef6d974537c1da03e524f1a8ef79a4d325c2f74e310dd8f8d3c0d40753b057c","method":"exact-v1","normalization_profile_version":null,"page_number":1,"reason":null,"status":"exact_match","verifier":"code:verify-quotes-v1"}},{"evidence_id":"evidence:synthetic_meridian_note:2","note":"Synthetic demonstration evidence; not a historical claim.","page_end":null,"page_start":null,"page_status":"not_paginated","quote":"Aylin Demo and Bora Example later co-authored the imaginary paper \"Gardens of Symmetry\".","quote_sha256":"bcf03281b2c98adccdf884e3a45a754287aac9f3e7213ca2bb8766fc9c0378b0","source_id":"source:synthetic_meridian_note","source_sha256":"87abdce55610c805edcbb0f169c54de090c66ac7690652163b221d013a88eadd","text_artifact_sha256":"c2384202e233a9dcb311ddd4ea7650a358d7bc444965f04b32e1517c4fd0f0d6","verification":{"char_end":187,"char_start":99,"match_count":1,"matched_text_sha256":"bcf03281b2c98adccdf884e3a45a754287aac9f3e7213ca2bb8766fc9c0378b0","method":"exact-v1","normalization_profile_version":null,"page_number":1,"reason":null,"status":"exact_match","verifier":"code:verify-quotes-v1"}},{"evidence_id":"evidence:synthetic_meridian_note:3","note":"Synthetic demonstration evidence; not a historical claim.","page_end":null,"page_start":null,"page_status":"not_paginated","quote":"Aylin Demo and Cem Sample appeared together at the fictional Solstice Mathematics Workshop.","quote_sha256":"e3de5122253da0bb5f9253a0e3012f8453c42dd92ce81b65cd64a4694fa8818b","source_id":"source:synthetic_meridian_note","source_sha256":"87abdce55610c805edcbb0f169c54de090c66ac7690652163b221d013a88eadd","text_artifact_sha256":"c2384202e233a9dcb311ddd4ea7650a358d7bc444965f04b32e1517c4fd0f0d6","verification":{"char_end":279,"char_start":188,"match_count":1,"matched_text_sha256":"e3de5122253da0bb5f9253a0e3012f8453c42dd92ce81b65cd64a4694fa8818b","method":"exact-v1","normalization_profile_version":null,"page_number":1,"reason":null,"status":"exact_match","verifier":"code:verify-quotes-v1"}}],"relations":[{"confidence":1.0,"direction":"directed","evidence_ids":["evidence:synthetic_meridian_note:1"],"extractor":{"model":"gpt-5.6-luna","prompt_version":"demo-candidate-v1","worker_id":"luna-demo-worker"},"member_subtype":null,"note":"Synthetic demonstration relation.","relation_id":"rel:demo_bora_aylin_teacher","relation_type":"student_teacher","source_entity_id":"person:bora_example","status":"accepted","target_entity_id":"person:aylin_demo","verifier":{"model":"gpt-5.6-sol","prompt_version":"demo-verify-v1","verdict":"accept","worker_id":"sol-demo-reviewer"}},{"confidence":1.0,"direction":"undirected","evidence_ids":["evidence:synthetic_meridian_note:2"],"extractor":{"model":"gpt-5.6-luna","prompt_version":"demo-candidate-v1","worker_id":"luna-demo-worker"},"member_subtype":null,"note":"Synthetic demonstration relation.","relation_id":"rel:demo_aylin_bora_output","relation_type":"academic_output","source_entity_id":"person:aylin_demo","status":"accepted","target_entity_id":"person:bora_example","verifier":{"model":"gpt-5.6-sol","prompt_version":"demo-verify-v1","verdict":"accept","worker_id":"sol-demo-reviewer"}},{"confidence":1.0,"direction":"undirected","evidence_ids":["evidence:synthetic_meridian_note:3"],"extractor":{"model":"gpt-5.6-luna","prompt_version":"demo-candidate-v1","worker_id":"luna-demo-worker"},"member_subtype":null,"note":"Synthetic demonstration relation.","relation_id":"rel:demo_aylin_cem_context","relation_type":"in_same_context","source_entity_id":"person:aylin_demo","status":"accepted","target_entity_id":"person:cem_sample","verifier":{"model":"gpt-5.6-sol","prompt_version":"demo-verify-v1","verdict":"accept","worker_id":"sol-demo-reviewer"}}],"run_id":"run:synthetic-demo-v1","schema_version":"shard-v1","shard_id":"shard:synthetic-demo-1","source":{"access":{"kind":"local","uri":null},"content_kind":"plain_text","ingest_version":"text-v1","language":"en","page_count":null,"rights_note":"Original synthetic text released with this repository; not a historical source.","sha256":"87abdce55610c805edcbb0f169c54de090c66ac7690652163b221d013a88eadd","source_id":"source:synthetic_meridian_note","source_type":"other","title":"Synthetic Meridian Institute note"},"source_id":"source:synthetic_meridian_note","source_sha256":"87abdce55610c805edcbb0f169c54de090c66ac7690652163b221d013a88eadd","source_text":{"artifact_sha256":"c2384202e233a9dcb311ddd4ea7650a358d7bc444965f04b32e1517c4fd0f0d6","ingest_version":"text-v1","offset_unit":"unicode_code_point_half_open","pages":[{"page_number":1,"printed_label":null,"text":"At the fictional Meridian Institute, Professor Bora Example supervised Aylin Demo's doctoral work. Aylin Demo and Bora Example later co-authored the imaginary paper \"Gardens of Symmetry\". Aylin Demo and Cem Sample appeared together at the fictional Solstice Mathematics Workshop.\n","text_sha256":"87abdce55610c805edcbb0f169c54de090c66ac7690652163b221d013a88eadd"}],"source_id":"source:synthetic_meridian_note","source_sha256":"87abdce55610c805edcbb0f169c54de090c66ac7690652163b221d013a88eadd"},"status":"READY","worker_id":"luna-demo-worker"}
